sn,comment,user,loc,thumbups
107940557,"On social media I have seen people give bizarre reasons against wearing masks. These make me to wonder what has happened to American critical thinking skills. 

At a Ventura CA county government entity, a stable genius follower said that wearing a mask ""is an act of submission, subjugation, of slavery, of shame."" SEE: 
twitter.com/nowthisnews/status/1278909582991953920

In Florida stable genius followers spoke out against a mask mandate. Some of the reasons given involved satanism, death, and pedophilia. SEE:
twitter.com/nowthisnews/status/1277814869840953345

Scary stuff! So much for American exceptionalism!",56505972,"South Dartmouth, MA",6
107940242,This administration including Fauci should be held criminally negligent. Fauci has been better than most but that is not saying much and he knew better. The message has been botched and no amount of shift in messaging will make it right. Republicans in particular are acting like idiots and they know better. There is no way they can believe their own rhetoric. It is ridiculous. Not only are more people dying than needed to but the economy is going to be hit worse than it would have been otherwise. I hope that states and individuals drown Trump and others responsible in lawsuits until he and they die.,68478906,"Bay Area, CA",3
107939475,"The 95 isn’t useful at protecting others.  So if you have the virus you can spread it with an N95.

It really only protects you.",62661042,USA,2
107939408,"Let me suggest another problem with getting people to wear masks: we're supposedly wearing them to protect others, and not ourselves. I see two problems with this statement:
A it's a lie, and
B in a country as split as this, protecting those ""other"" people, especially those too lazy to wear a mask, is not very motivating.

RE ""it's a lie"": When I purchased N95s a few years ago as I was about to insulate my attic, I wore my N95 to protect myself, not to protect the insulation. Anyone who's bought masks as a part of a hobby or home repair knows that masks protect the wearer. So once again the CDC is obfuscating, basically lying to us. I sense the reason is that the t-shirts cut into masks don't really provide much protection, so the authorities are trying a different argument. If homemade masks are not effective stopping small particles one direction, they're not going to be effective with particles moving the other direction either... Once N95s are widely available, the CDC will need to pivot once again, and tell the truth. Meanwhile cities like San Francisco are actually banning N95s with valves, the best mask you can have, since the valve is proof that the mask is for the wearer. Enough of the lies. Tell the truth, and tell us when N95s will once again be widely available.",40828043,SF,2
107939342,"You, like so many others, let Dr. Fauci and his CDC counterparts off far far far too easily. I’m sorry, their early advice on masks was literally dead wrong. What they could have said was that “we need every available N95 mask for frontline health care workers so DO NOT BUY them. BUT, this is America and we are an ingenious people, make your own masks here are links to how and wear them every time you leave the house.” Instead they denigrated and belittled mask-wearing. This was a BIG mistake on par with many things our criminally negligent president has said and done. Stop pretending it was otherwise. Just because Fauci and CDC officials are scientists does not make them right or infallible. And it might help if they had the cujones to state clearly and emphatically that they were wrong.",48341284,New York,10
107940039,"Remember back when we had a President, and Obama would say things like, “Don’t let the perfect be the enemy of the good,” and, “don’t do dumb stuff?” 

Yeah, me too.

Stay mostly home. 
When you go out, wear a mask and keep some distance.
Wash your hands a lot.

Don’t be a jerk. 

Seems pretty simple.",66788641,Out west,10
107939552,You don't want to wear a mask? Fine. Just stay home.,83007384,Colorado,2
107940804,Pro Life? Put on a mask!,78952500,MI,2
107939536,"Looks like even Sean Hannity recognizes he can't keep telling people to not wear masks because people will die.

He made this Fox public service announcement.

<a href=""https://www.yahoo.com/entertainment/hannity-releases-psa-urging-people-to-wear-masks-i-dont-have-a-problem-wearing-a-mask-053205835.html"" target=""_blank"">https://www.yahoo.com/entertainment/hannity-releases-psa-urging-people-to-wear-masks-i-dont-have-a-problem-wearing-a-mask-053205835.html</a>

How do Fox listeners reconcile this 180 degree change?",46988223,the South,1
107940611,"Instead of giving us N95s. DHS gave us cotton masks made by Hanes. FEMA took 500 000 masks from the VA and gave them to strategic supply. I got 3 N95 masks instead of 10 for my physicians because we are in short supply. So sometimes we had to whip out the "" underwear"" masks until we finally got surgical ones .",70156509,USA,2
107940758,"The fact that a medical supply company, early on, offered to produce a million masks a week and was turned down by Trump is an abomination.",74745793,New York City,5
107937562,It’s a simple reflection of how you feel about the people around you.,21797719,New Jersey,3
107940251,"What really, really annoys me is that those exercising their ""rights"" have revived the image of the ""ugly American.""  Quite apart from stunningly poor hygiene, those traveling on US passports will be presumed to have no consideration or even manners in host foreign countries.",67873433,"Sonora, CA",2
107939474,"Why is there a division among Americans over the implementation of  pandemic control?
Answer: d. j. trump.
This November,
 ""Make America
America Again!""",18727659,"Palmetto, FL.",3
107940245,"Deciding to wear a mask is not  political statement.
It is an intelligence test",40481400,Alexandria.Virginia,8
107939894,"To those who think wearing a mask is an infringement on their rights.....
1. I promise not to drive drunk. 2. I promise not to flush cherry bombs down the toilet in a public building. 3. I promise not to knowingly spread smallpox. 4. I promise to wear a mask because it is the best thing to do right now in light of the evidence as presented. If your doctor says not to do something that puts your or your family's health at risk, do you comply? Well the doctor is begging, pleading, confronting you with an overwhelming body of evidence that supports the idea that face masks are the best means of mitigating the spread of this virus, and yet some a rising up in rebellion. Put the statement ""I have a right to"" in front of drive drunk, flush cherry bombs down the toilet in a public building or spread smallpox-kind of ridiculous, right? Perhaps then you will see how baseless your defense of your right to recklessly endanger the health of others truly is. One would hope that you would then see the validity of statement 4. Hoping for the rest of us........",37931823,philadelphia,1
107940876,"If you hate wearing a mask, you'll hate wearing a ventilator worse,  I promise.",25689932,Midwest,9
107940892,"A friend mentioned how she has presented the situation and I think any reasonable person would think persuasive:

If I'm right & you are wrong, you might unknowingly kill someone.  If you are right and I'm wrong, I might experience a few minutes of bearable discomfort.",16021966,Atlanta GA,4
107939560,"A woman behind me on line for a grocery store today was too close about 2 ft from me and had no mask. My town has a ""face covering"" ordinance including when standing on line outside.  Out governor has a similar public health order.  When I told the woman that she was too close, she said it didn't matter.  When I said it mattered to me that she was too close without a  mask,  she told me to stop gripping.  It was obvious she did not care about me and I told her that.  She kept repeating Have a nice day or shut up---What a RAH as Holden Caufield would have said.",12764179,santa fe nm,2
107940548,"Lead, follow, or get out of the way. Trump is not leading or following literally causing people to die because he has not gotten out of the way. Many more will die before he is out of office. Think long and hard if you voted for him when all the evidence of his immortality and incompetence was out there. We can afford to have a fool for president just because he validate your prejudices and bad science.",55006778,Austin,0
107940741,These no mask people are the same blockheads who used to give me a hard time for wearing glasses.,59545008,NYC,3
107941792,The only people complaining about wearing masks are the people NOT wearing them. This is how far we’ve gone down the rabbit hole of ignorance.,65032288,NYC,1
107941818,"As to those who refuse to wear masks out in public because the wearing of masks denotes some elitism, I’m getting kind of sick and tired of this false trope. Why is it elitist to be educated and well informed? Why is it elitist to follow simple hygiene towards others? Has the notion of liberty been so distorted to mean one can take all fellow citizens for granted as long as you feel unencumbered? It use to be aspirational to want your children to be better educated and informed than oneself, to have a better life for all. Now it’s looking out for oneself, all others be damned. Unfortunately, this didn’t start with Trump, it’s been festering since the 70’s, Trump is just the triumph of the ignorant minority.",55534651,"East Windsor,nj",16
107940423,"It's just a mask?
It's just two weeks.
It's just non-essential businesses.
It's just to keep from overwhelming the hospitals.
It's just until cases go down more.
It's just to keep others from being scared.
It's just for a few more weeks.
It's just communion or singing. You can still meet.
It's just until we get a vaccine.
It's just a few side effects.
It's just a bracelet.
It's just to let people know you're safe to be around.
It's just for the coronavirus vaccine.
It's just an app.
It's just to let others know who you've been in contact with.
It's just a few more months.
It’s just a video.
It’s just an email account.
It's just for protecting others from hate speech.
It's just a few people.
It's just a credit card company. You can use cash.
It's just a few places that don't take cash.
It's just a little chip.
It’s just for medical information and paying for things.
It’s just so you can travel.
It’s just so you can get your driver’s license.
It’s just so you can vote.
It's just for a few more years.
It's just a statue.
It's just a building.
It's just a song.
It’s just a piece of paper.
It's just a flag.
It's just a piece of cloth.
It's not just a piece of cloth.

It's not just a mask.",129539569,Earth,8
107939729,"I wear a seatbelt but I feel ridiculous wearing a mask because there's ""no direct evidence"" it works, according to WHO as linked in your article, and the extent of asymptomatic transmission is ""unclear"" says CDC. I don't do stuff unless there is an intellectual argument, or some valid thought process. The brainlessness of this is actually alarming to me.",71812884,Boston,4
107939893,"I live in the DC area, and I hope that trump's salute to america does not bring hoards of his anti-masker supporters to the area. He insisted on having it still go on. DC's covid reproductive rate is not bad at all, although Maryland's is going up.

Biden supporters: stay home, go nowhere near the Mall. We need you.",75047746,in NYCitayy,9
107939951,"I would like to draw attention to an often overlooked problematic issue in Jesse Wegman's editorial.

Jesse Wegman writes, ""If all Americans were required to wear masks in public, we could reduce the number of daily cases to a level that would otherwise require lockdowns that would slash nearly 5 percent, or $1 trillion, from the nation’s gross domestic product, according to an analysis released this week by Goldman Sachs.""

Wegman doesn't explain who would enforce this? If he has the police in mind, that raises the problem of police attempting to interact with people who may not want or even consent to such interaction.
The police has a history of violence. And they also have a vicious record of arresting innocent people. This is far worse for blacks or other minorities.
When a person proposes that the government impose some policy, they might be thinking of a ""benign government,"" but in reality, it has a long rap sheet of evil.",95469526,California,3
107941185,"It is interesting to note the quote: ""members of the Church of Secular Science bow to the Gods of Data by wearing a mask as their symbol, demonstrating that they are the elite; smarter, more rational, and morally superior to everyone else.”
Just as with Trump everything is reversed to preserve tribal identity. It is a ""religion"" to reject science and technical expertise but the shoe has to be put on the other foot, as in technical-minded people are the tribalists. This creates the false equivalence that we are all just rationalizing.",13791667,Brooklyn,2
107941348,"“Mask-wearing has become a totem, a secular religious symbol,” Alex Castellanos, a longtime Republican strategist, told The Washington Post. “Christians wear crosses, Muslims wear a hijab, and members of the Church of Secular Science bow to the Gods of Data by wearing a mask as their symbol, demonstrating that they are the elite; smarter, more rational, and morally superior to everyone else.”

Wow; where to begin?

As someone scientifically educated and employed, it's clear that Castellanos is neither, so his ignorant insults, while typical of Trumpublicans, are just that---ignorant. He tries to caricature science as a church ""bow to the Gods of Data""?! because he in fact has no idea how scientific or perhaps even rational thought proceeds. A man who sees life as a zero-sum battle of verbal invective is probably incapable of imagining that other humans think and live differently.

In particular, he's probably incapable of considering that many of us regard mask-wearing as something that has nothing to do with political identity. A lifelong Independent, I have health issues that necessitate caution, but more than anything I regard mask-wearing as a matter of civic duty and concern for my fellow citizens, the exact opposite of regarding myself as ""superior"" to others.

Mr. Castellanos should switch to decaf and keep his mouth shut in public unless his employer has hired him specifically to drive away potential voters.",45104504,Sinope,9
107940935,"I am an anesthesiologist. I am an expert at placing the breathing tubes people need when they are too sick with COVID-19. My colleagues along with our Certified Registered Nurse Anesthetists implore you to wear a mask. We wear n95 masks for hours on end and if you think your mask it uncomfortable, makes it hard to breath and hard to communicate, try strapping an uncomfortable pillow to your face. 
Simple face masks do limit the spread of this disease. Take it from me because I've seen it often; death is never pleasant and rarely welcome. Death on a ventilator is worse. Protect yourself and others in your community and think of all the healthcare workers who will have to care for you and expose themselves to you because you didn't want to wear a mask. You do not have the right to spread disease and death. Just wear it.",77624529,Pennsylvania,32
107939041,"Great column.  Now, if only the right people would read it.

I recently read a poll about why people do or do not wear masks. A sizable proportion of those who didn't wear masks said it was because they weren't effective.  If seeing is believing, take a look at this video of someone speaking and yelling with and without a mask. the ""mask"" was a slightly damp washcloth.  Click on link to article, then on video.
<a href=""https://www.nejm.org/doi/full/10.1056/NEJMc2007800"" target=""_blank"">https://www.nejm.org/doi/full/10.1056/NEJMc2007800</a>",51024548,Denver,1
107939845,"Common courtesy? In Trump's America? What a quaint idea. Patriotism? Patriotism is waving a flag, toting an Uzi, and shooting people you don't like; it is not being mindful of the health and safety of those around you. I'd like to tell the anti-mask faction that their right to die does not give them the right to kill me or mine, but that wouldn't be courteous now, would it? And it certainly wouldn't be patriotic because it's an idea based on preserving lives, not taking them.",51639494,"Flemington, NJ",6
107940534,Leave it to Trump and his followers to make a simple thing like  wearing a mask a political statement.,59545008,NYC,8
107939625,"Yes.  It's not complicated:  wear a quality N95 mask!

If a quality  N95 mask protects medical personnel, it will protect you.  

Don't let your health depend on the behavior of your neighbor.  Protect yourself.  If you remain virus free, you won't infect others.

Yes, we need hundreds of millions of quality N95 masks.",58309940,novato ca,5
107939750,"Maybe run ads with pictures of people wearing masks in 1918 and the caption, ""Even your great-grandfather knew about this simple way to reduce transmission of aerosol-borne diseases!""",26422750,Hamilton ON,7
107939445,"Here in Los Angeles, an extraordinary number of people seem to be under the impression that merely wearing the mask around  your neck is sufficient, as does every single LAPD officer that I have seen since this began.

The height of selfishness.  Why can't we be a ""we"" country, like Japan?

The US is now a third world mess, possibly worse.",66892385,Los Angeles,10
107939906,"Only one side sees “mask-no mask as a political statement. Those of us with brains view this as a civic responsibility to protect the health of others. You want to make health a political deal, go ahead...and, you’re welcome!",82409470,The Great Flyover,5
107941194,This entire mask mess says more about the individual than the virus.,68938663,Midwest,9
107939394,Fully support Trump not wearing a mask…as he should stand by his principles and gut.  He is always right in trusting his gut. Trump refusing to wear a mask is good for the country as it increases the risk that he comes down with the corona virus.  Fervently hope he becomes infected with the virus to give him first firsthand knowledge of how it feels to be infected.  It will be the only positive thing he has done during this crisis.,28549901,TX,3
107939511,This is not all Trump's fault. Trump lied. Even his loyal followers know he lies constantly. The governors made the choice whether to close or reopen. We made the choice whether or not to wear masks. We as individuals make our own choices. We all have brains. Whether or not we choose to use them is on us. Not Trump or anyone else.,78899448,"Anchorage, AK",2
107940287,"Trump missed his W moment in stepping up to take on the COVID19 threat. He could have corralled a big group of leaders and celebrities to lead the charge and fire up Americans. But, no. For a self professed genius businessman he passed up a great opportunity which says something about his business acumen. If more Americans followed the English version of foreign news media they would see what is going on in the rest of the world. Mask wearing is a given in Asia - to fight pollen, pollution and more before COVID. A billion people can't be wrong.",60949197,Hawaii,1
107940403,"Yes, it's a given, the mask logic is obvious.    If we had a real President, a leader, I'll bet all he would have had to do in March was to ""declare war on the Corona virus"".    Like the war on  drugs, war on crime, war on cancer, etc.   People love going to ""war"".  It's a macho and unifying thing.  It might have worked, maybe it's not too late?",50548072,Chicago,1
107941155,"We should all take a moment to realize that IF, like other countries, we had used the last 5+ months to prepare, and now had ample N95 masks for *everyone,* everyone would be significantly safer. Including ample training and guidance on how to use them. 

Essential workers would be safer, children and grandchildren would be safer, voting in person would be safer, re-openings would be safer. We most assuredly wouldn't be seeing the spike we are currently experiencing. 

We EASILY could have met this goal, but Trump's catastrophic mismanagement and negligence, along with his callous, sociopathic indifference mean that 5+ months into Covid-19, we still don't have adequate PPE for First Responders, still don't have adequate testing, forget functional contact tracing.

As a result, instead of being the gold standard in the face of Covid-19, because of Trump, we are a cautionary tale of how Rep-limited gov Plus the election of an orange insane conman has led to over 120,000+ dead Americans that if Trump's response was even marginally competent, never had to die. 

Instead we are using homemade masks..... One of the wealthiest, most tech adv countries in the world, even with 5+ long months, still can't provide its citizens adequate N95 masks nearly every other dev country is able to provide their citizens. 

120,000+ deaths is how bad Trump has failed America....

Lets give him a party to celebrate his rule, putting Trump beside other actually great men of Mt. Rushmore ! 


.",94204600,MN,0
107941695,When citizens take even the suggestion of wearing a mask as a threat to their human dignity they have confused personal freedom with the enshrinement of adolescent narcissism.,75935777,Los Angeles,11
107939531,Hospital beds should be reserved for people who wore masks,9606929,PA,3
107939918,"If someone refuses to wear a mask in a store, don't confront them and start a physical altercation. Just refuse to check out their items at the register. No mask, no service. You're breaching social distancing when wrestling on the floor showing how righteous you are.",81050575,"Bellingham, Washington",0
107939629,"Wear a mask AND social distance because... it's EASY... if there is even half-decent evidence that it will help reduce the impact of COVID, get people back to work and the economy moving quicker..

Just do it because it's the easiest thing you could do... 

Talk about American privilege... wasting all this time fighting about something that is completely irrelevant compared to the fact that people are sick and dying.",82202242,Los Angeles,5
107939716,"Please some company make masks with the word ‘RESPECT’ across the front.  That is what is needed.  People need to respect others’ right not to get sick unnecessarily and die before their time.  They need to respect the world, the science, and each other, as the pandemic us out of control. How can you say your Pro life and be okay with Republican leadership that are okay with tens of thousands dying in our country, while other countries have 10 times fewer needless Covid deaths. Nor can they say they are ‘law and order’ when they support a president who has broken our laws and us so chaotic and disorderly, we still don’t have enough masks for the front line workers 6 months later from when the N95 company said they would scale up if asked by their country.  You can not say you are patriotic if you don’t abhor what Trump has done in allowing Russia to put bounties on our soldiers heads and then continue to invite them to the White House and to be included in the G7 plus pulling troops out of Germany.  Trump has NO respect for our Constitution, nor the rule of law, nor our checks and balances to his power.  He cares little about anyone else but himself unless in doing so he can maintain power and wealth.  Our country is being held hostage by this aristocracy of greed and corruption and we want our country to be better than this.  We need it to be better than this.  Justice will be served. The day of reckoning will come.",32790096,"Albany, NY",1
107939782,Mask it or casket,135126794,California,8
107941236,"The medical literature does not support that wearing a mask in public reduces virus transmission. Don't believe me; believe doctors in the Department of Public Medicine at Harvard Medical School.  They wrote in an article published in the New England Journal of Medicine, May, 2020 <a href=""https://www.nejm.org/doi/full/10.1056/NEJMp2006372"" target=""_blank"">https://www.nejm.org/doi/full/10.1056/NEJMp2006372</a>, 
""We know that wearing a mask outside health care facilities offers little, if any, protection from infection... In many cases, the desire for widespread masking is a reflexive reaction to anxiety over the pandemic.""",77220487,"North Hampton, NH",2
107941830,"The willful ignorance of Republicans and their supporters is horrifying.  They accuse Dems of politicizing Covid-19, but they politicize mask wearing.  Unreal.  There is a clear divide between sane rational people and Republicans. I’m not sure the country will survive this, which is what Russia and China want",68292290,USA,1
107941860,"Sadly you're preaching to the converts. The antimaskers are the new antivaxxers, except even more deadly and more delusional.

 They believe that the act of saving lives of others is really a tyrannical ploy by the ""Dems"" and the deep state to take away their freedom. They believe that *they* are the real heroes defending the Constitution. 

The above are the more rational antimaskers. Many are even more delusional - they believe that the masks are a part grand conspiracy theory involving George Soros, Bill Gates and other actors. These are the Qannon types who see any attempt to control COVID as a satanic ploy. These are the folks who burst in grocery stores without a mask often yelling racist slurs.

No amount of reasoned arguments will convince those people.",46382827,California,4
107940232,"Mr. Wegman says that masks are proven to work, but links to an article that says the WHO says there is no direct evidence masks work. Can we get adhere to a higher standard of journalism?",71812884,Boston,2
