sn,comment,user,loc,thumbups
107937497,"I’m extremely concerned about what’s happening. I moved to a small town where most are retired, white, wealthy and in my next door app I refuted a claim by a non medical PhD that claimed that’s they’re seeing a significant increase in herpes, sinus infections, upper respiratory infections due to masks. When I asked if this “doctor” was a clinician he doubled down. He was not a clinician Then I asked two hospital clinicians and they said no. When both myself and my partner a hospital administrator and doctor replied that they’re not seeing this a whole mass of believers not only didn’t provide a shred of data that supported that claim but outrightly ignored anything we cited and defended the retired PhD as if he was god. He displayed all the signs of NPD deflect, devalue, distract, demean, etc and the group ate it up. These are educated wealthy people in the highest risk group. Whatever is happening to our reason and logic it’s frightening. I do not see a way to solve this.",40871261,NYC,15
107937423,"I'm a VN war veteran so I can relate to the fact that C-19 virus has killed more Americans in 4 months than the Korean, Vietnam, Gulf, Afghanistan & Gulf wars did over 70 years.  Soldiers of all ranks are required to wear at least 30-40 lbs of protective armor & equipment for days at a time in high temperature weathers, as in Afghanistan.  Masks are a lot easier to breathe with than a ventilator. Those comments were authored by others but I agree totally.",118535313,NW FL,8
107937406,"While there is no question that multitudes of Republicans are proud members of the anti-mask brigade, marching in step with their maskless leader, it is a false accusation that it is ONLY Republicans who are complicit in the painfully slow acceptance of face masks.  Even after the evidence was in, health departments, other local jurisdictions, and state governors both red and blue states were reluctant -- generally for political reasons, not science-based reasons -- to issue mask mandates.

Very few *leaders* had the courage to issue mask mandates early -- they dragged their feet until the genie was exploding out of the bottle, and now the bottle is broken!",84485682,Bellingham,4
107937400,"I'm somewhat amazed that mask wearers, other than employees enforcing a policy, will sometimes vocally challenge those who are not wearing masks in stores. That may provoke an angry response, in which the non-mask wearer spews potentially virus-laden droplets and aerosols right at the critic. Better to shop at less crowded times, give the non-mask wearers a wide berth, get your business done as quickly as possible, and leave.",56770124,"Indianapolis, Indiana",9
107937399,"Fine, good point.  It is absurd that anyone in this pandemic would refusing to wear a mask.  Where do these people get these crazy ideas?  Well, tonight, President Trump is staging a fire works display at Mount Rushmore not in D.C. because there would be more protesters than attendees.  7,500 are expected to attend. And yet, masks will be available but wearing a mask will not be required.  Social distancing will not be required.  Maybe nearly everyone at that event will wear masks. We will see.  Just ten days ago, when Trump was telling his deluded followers that wearing a mask would signal that they were liberal, Trump came to North Phoenix and staged an indoor rally with at least 3000 attending with no social distancing and maybe a few dozen apparently older attendees wearing masks.  Phoenix is now far more than a ""hot spot"".  It is becoming the scene of a Chernobyl scale public health melt down.  As a North Scottsdale resident who has been directly endangered by Trump's criminal conduct, I am trying to understand why it is that the office holders in the Senate and House in Washington do not get together a force Trump's immediate resignation for the good of this country.",78352702,Phoenix,15
107937397,"American Credibility: I’m an American working in Asia who has been heavily engaged in corporate response for COVID-19 since early January well before the West began to wake up. The American government has little credibility. At first the US government chose to ignore it and cast it as yet another Asian problem. Later, it said don’t wear masks for whatever reason. Some US locations take action and others not. I’ve been in meetings where senior business executives in Asia can rightly claim that the US has been wrong on every turn during this crisis - why should we listen to them.",58046901,Singapore and Tennessee,17
107937378,Near my house there is going to be a Herd Immunity Music Festival for three days. The name was just recently changed. Wisconsin Republican legislators sued Governor Evers to prevent State mandates. It was to be local control. The local county supervisors tried that and the Chamber of Commerce sent the supervisors a letter threatening a law suit if they tried to pass an ordinance. The Chamber hired the same lawyers used by the state legislators. The county cannot afford a law suit. I contacted each supervisor about this and have suggested a meeting with the chamber with those who I spoke with by phone. Will probably be too late for the three day drinking binge.,40729336,Wisconsin,3
107937376,"Trump could’ve made a fortune, a real one this time, if he’d just started out by telling all of his supporters to mask up with an official MAGA mask featuring his face and name, exclusively available on the campaign’s website. Too late for that now. He’s really bad at business, too.",68293829,Claremont CA,19
107937369,"What does Alex Castellanos think about shirts and shoes, which the last time I checked were required to enter any business in America?",68556367,"Fresh Meadows, New York",8
107937322,"Life and the economy will not return to normal until the Pandemic is safely under control.  Even those who are not likely to have serious illness, if infected, are nevertheless impacted by the poor economy.  So it is in everyone’s best interests to do what they can to control the spread of the virus.

What individuals can do:

Social distance
Mask
Reduce touching the face 
Wash hands frequently 
Disinfect
Avoid indoor gatherings and crowded outdoor gatherings
Self-quarantine if you have engaged in high risk behavior

Masks are not guaranteed protection against getting the virus.  But they will stop some airborne molecules and prevent your sneezes and coughs from dispersing molecules widely. And masks serve as a reminder not to touch your face.

For those like the Republican strategist or Sen Paul who rail against experts the Deep State, I suppose we could return to the Medieval period, before medical advances.  Of course, most people didn’t live much beyond their 40’s.  What foolish people!

And those freedom lovers who think they have a right to do whatever they please even if they endanger others: go find an isolated island.  Because you are not meant to live in a country where freedom comes with responsibility.",47349721,California,20
107937281,"""slowing the spread"" , ""flattening the curve"", and what ever other message of the day is being broadcast does not seem to be effective in dense population areas like US cities. To politicize the issue is irresponsible and undermining our republic.",62983307,USA,2
107937264,"Republican governors are finally waking up to the reality that Trump has constantly dismissed. Trump's reckless influence on them has cost lives and turned what should have been a nonpartisan effort to combat the pandemic into a deep, perhaps irreparable rift between Republicans and Democrats. It's ironic that Trump, who is desperate to revive the economy, is sabotaging that goal by failing to promote mask-wearing and social distancing, two practices that can mitigate C-19's assault.",13957398,New Hartford NY,11
107937203,"This has become Mask Hysteria.  Instead of the mania, we should be looking at the science.  It says: most homemade masks are virtually useless.  It says: H95 masks have pores that are 300 nano meters; the virus is 150 nano meters.  It says:  Cases in the US had been declining until Mid-May.  It wasn't because more people were wearing masks.  It says: Cases in the US surged up after Mid-May.  It wasn't because fewer people were wearing masks.  It says: masks that are too restrictive will cause blow out from the sides when coughing or sneezing.  Less restrictive masks are..less restrictive.
That's what Science says.",90314637,Chicago,5
107937198,Rawhide TV Show's smallpox episode showed people wearing masks.  How were we allowed to drift this far away from the old normal pandemic zeitgeist?,93501576,United States,5
107937189,"here is an idea - if you refuse to wear a mask you forefoot your access to health-care rather than pay a fine etc..  Folks who don't wear a mask put us  and the healthcare system at risk and, apparently, they feel immune to the virus.  I am sure there would be good ways to enforce.",58097617,Princeton NJ,8
107937175,"""This is not complicated, folks.""
Those five words boil this issue perfectly. America is being whooped by this virus."" we have this under control, it will fade away."" These words by this President are being proven wrong almost every day by the record smashing totals of virus cases. Both of his statements are outright lies.
   You can not have a economic recovery until we get to the point where are curve has been flattened in a fashion similar to what you see in the EU.We closed up too late and we re-opened to early. We have to start again.
 Step one. Nationwide mask requirements. It is not a cure. We have to wait for a vaccine for that. But mask wearing will help reduce transmission rates. It's a fact. It's simple. It harms no one. It's cheap. There is no rational or scientific argument against it.",88992647,"San Jose, California",10
107937157,"Seriously your missing the issue. America is not about ""us"" it's about ""me."" Everyone should be waking up that our personal image of self is what defines us not embracing the worldly view of doing the right thing for all of us. Don't accept that? Trump knows who his audience and preaches to it every day and it doesn;t matter is how unpresidential it looks. There will be no climate change, equality, social reforms because we ""all"" about choices not mandates or orders or laws.",94804121,California,2
107937137,"I was raised in a religious household and happily left it behind when I left home. Never thought I’d find a church I’d want to join, but sign me up for the Church of Secular Science! I’m already a believer, and how wonderful it is to have found a home.",80613719,Dripping Springs Texas,38
107937083,"Masks? Yes, of course. That is the least we should be able to do. But, seriously, the WHO declared a ""Public Health Emergency of International Concern"" in January and still we have no coherent federal program for testing and tracing infections - the one tried and tested way to respond to a pandemic such as this. If Mr. Trump is unwilling or incapable of taking on this challenge he should resign and let someone else take on the task of saving our lives and our economy.",65689499,Hanover NH,9
107937038,"Seriously folks, just drive the speed limit, wear your seat belt and don't drink and drive.  That alone will save 1.25 million lives world wide each year.  But we don't want to seem to do that even though there are fines and jail time associated with breaking these laws.  Yet we're all supposed to don masks and keep six feet apart because that will go a long way in keeping us safe.  Everyone's going to do that.",61748246,"Murfreesboro, TN",1
107932909,"Let's not kid ourselves.  The anti-mask Republicans did not suddenly become followers of science.  They were only too happy to jump on the freedom loving mask hater bandwagon when they thought they could leverage it for political gain.  They thought the virus was only a blue state left coast problem.  

In the last few weeks, the virus has run roughshod over red state America and it's costing the Republicans votes.  They are rapidly losing support and are in great danger of losing the Senate as well as the White House.

So lo and behold, they are now embracing the mask.  But I fear it is too late.  The virus operates on its schedule, not Mitch McConnells.  The anti-mask movement is now in full force and the virus is on the move.

That's what happens when politicians game public health for power.  Everyone loses.",38331232,"Kansas City, MO",1426
107933125,"I wear a mask to the grocery store and to a big box retailer if I ever have to go but otherwise don't bother and am NOT going to wear one outside. 

It is too late to stop the virus. Social distancing was working until the protesters decided their temper tantrum trumped public health. Now the best thing for the country is to develop herd immunity. Do all of you really think Biden and the Democrats will be better off inheriting a ruined economy? The Democratic Party would never survive it. 

If you have any issue with the coronavirus spike, again, blame the protesters.",71578093,Essence,14
107933794,Remember there was not enough masks for the health care workers and other essential personel when the pandemic hit hard in February and March.,77820002,"Topeka, KS",7
107936343,Public Shaming is important to the current narrative. NYT published a picture of the Pride Parade with a Woman I think wore no mask and wasn't criticized for it. Why? Protestors don't wear masks and are not criticized. Maybe if there was less hypocrisy there would be more conformity.,23097608,Garden City,6
107933436,"When I go out, I wear a mask. 

Having said that, the initial advice was to actively stop mask wearing. 'counterproductive'  was one of the reasons given to not wear a mask i.e. that it is actually not good to wear a mask. Not that it has no benefit. It was that wearing mask is actually not a good idea. That cost the trust of the people. And more than that - many view it as the state pushing people around per its whims and fancies. One minute they chastising people for wearing a mask and the next they are chastising people for not wearing it ! There is a a dislike for state pushing people around like this among certain sections. People expect to be given the true to picture and not second guessing. I do not believe the govt. experts have any authorit to second guess the people they provide advice for. 

Further, have those giving advice to wear a mask - thought this through ? I mean, are there any exceptions to this ? Perhaps it is not ok for certain people to wear a mask ? It could be suffocating for some. A blanket advice is not always applicable in science. There are always exceptions. But you do not hear any exceptions and how to adjust to those exception scenarios to ""wear a mask"" advice, from the experts. 

Makes one wonder who is actually making this a political issue ?",73566340,Whereis,4
107932981,Recall that there are some municipalities with mandatory gun laws - expect these places will likely resist any mask laws.,19449833,Sydney,7
107932812,"According to the cdc, the virus has a .0009% hospitalization rate for majority of Americans and a .002% hospitalization rate for those 65+.  Logic therefore dictates that covid is not overly dangerous.  According to CDC, the 2019-2020 flu had a .003% hospitalization rate for majority of Americans.  Query:  how low must the hospitalization rate for a given virus be such that wearing a mask is NOT required?",78117660,Pennsylvania,3
107933364,"If you purport to be about the science, then take the time to get it right. 1 SARS-CoV-2 is small enough to permeate cloth masks, so they're not doing too much. 2 If you can maintain social distancing, there is no scientific reason to wear a mask. This is just shaming and fear-mongering. I'd expect more from an ed board member. Read more science.",66413597,Ct,12
107933793,"I love how this article references another globe article that talks about the W.H.O as validation that wearing a mask is effective - truly funny.  Here is an easily verified statement:  there are no independent scientific studies that show wearing a mask in a social setting is effective in any way.  Just google it yourself.  The key word here is independent study.  But let's leave that and go to simple logic.  If you are wandering around as a Covid carrier wearing a mask, what you are doing is concentrating the virus in your mask;  then when you touch your mask, as you inevitably will, you will spread concentrated virus all over the place.  That's why hospital workers are constantly changes masks and gloves.  So the article is accurate in the sense that this issue is not complicated.  Masks make things worse in a social setting.  And the health workers and administrators who know this to be true - shame on you.  Speak up.  And for those of you who wear a mask 'to protect others' - you need to stop your virtue signalling and read a book.",66318340,Earth,5
107936945,"No shirts, no shoes, no mask, no service. 

No seatbelt, you can get a ticket.",67037842,On This Crazy Planet,9
107933544,"No shirt, no shoes, no service.  Seen for years on doors of  restaurants and businesses .

No one whined or threatened the staff at establishments that posted the above . It was the safe, hygenic and polite thing to do.

When did we become so  short-sighted, self-centered ,   and short tempered?",77200552,NJ,707
107936935,Wearing a mask is annoying.  So is wearing a shirt and shoes when I go to Arby’s.  So is driving 20 miles per hour in a school zone.  So is not being able to beat someone up I disagree with.  Society... so inconvenient.,67961713,Brooklyn,51
107932825,"""It’s not about making a political point or asserting moral superiority; it’s about saving lives and protecting one another — which should be a basic element of citizenship in any democracy.""

It's more than that. Wearing a mask is a very minor act of sacrifice. And sacrifice is what patriots do for their country. 

Wearing a mask should be seen as a sign of patriotism.",39058427,Between Pole and Tropic,614
107932833,"It ain’t hard. I was skeptical of the effectiveness of masks at first. Then I read evidence. I am no longer skeptical of the effectiveness of masks. The evidence says they work.

And that’s how logic and reason works. You start with an idea that isn’t correct. Read evidence and facts about why the idea was not correct. Then, adopt the idea best represented by facts and evidence.

It’s disturbing how many people are afraid to admit they were wrong about something. Learning is a GOOD thing. Changing outdated and inaccurate ideas based on new evidence is a GOOD thing. Because that’s how people grow. The current widespread behavior of people digging in with false beliefs all because they don’t want to have to admit they were wrong is not healthy.",86086722,"Denver, CO",731
107936903,"My recent  research has discovered that wearing a mask protects the wearer and not others, just like a gun. I expect that when I make the results public in a soon to be released book, there will be bigly increased demand to own and wear masks as an extension of the second amendment. SCOTUS will provide a ruling in support of that interpretation after an initial challenge. The current POTUS will never be seen without his mask. Trust me, this works.",72993868,Toronto,4
107932772,"I wear a mask not to demonstrate that I am ""the elite; smarter, more rational, and morally superior to everyone else” as the Republican strategist, Castellanos, says.

I wear a mask because I respect the people working in the grocery store. I realize they probably don't have that great of health insurance and can't afford to miss work. 

I don't have great health insurance and can't miss work either.

The elites are in their second or third homes. Not shopping for their own groceries.

I wear a mask because I recognize I am vulnerable and grocery workers are too.",81585724,US,1633
107936893,"In a more perfect world decent masks would be as available to the public and as easy to get as a carton of milk. Yes, people can make their own, but it’s another friction point in getting people to wear them.",37080611,Virginia,3
107936888,"How about liberty?  

Good hygiene and common courtesy should twist or change one of our guiding principles?  

Until we address the question and reach a consensus on this question, we are still going nowhere. 

Otherwise, we should accept the fact that liberty has its limited applications.  Not anywhere or any place that we can use liberty as an excuse not to follow or not to do.",21583573,Houston,1
107936882,"There is a lovely Mennonite produce/bakery stand near my house that I used to frequent. In April, after hearing that this stand had some masks for sale, I inquired. The woman at the counter unmasked sort of chuckled. The next day I stopped back in, only to see a large sign behind the counter that read, “Which do you prefer for protection? God or a face mask?” None of the workers there wear a mask despite it being a mandate here. They lost my business forever.",70731928,PA,20
107936362,"I think part of the resistance to masks is that people always have their hands in their mouth.

They smoke. 
They pick their teeth.
They lick a finger to count money or open a plastic bag.
They chew their thumb when they think.
Men scratch their stubble, women put on lipstick.
They sample grapes at the grocery store.
Some people use their teeth like an extra hand, holding a pen while they rummage in their pockets or gripping their keys while they pump gas.
And they snack.  And sip beverages.  Constantly.

It's tough to break habits.  Especially when you're too stubborn to try.",63446969,Tennessee,11
107934903,"In general, you don't really need to wear shoes, and most people are shoeless around their own homes or while partaking of many different kinds of leisure activities.  There are no public health crises associated with the shoeless, although some might claim you cause an infinitesimal increase in the odds of you or someone else catching deadly athlete's foot in a public shower, or that you might slip on a recently mopped floor.  I understand that these public helath risks don't approach those associated COVID 19.

 Yet it's a social norm, and accepted as required attire, to have shoes on in almost all situations when you are inside a building, and many outdoor public spaces.  Shoes cost much more than a mask and take longer to put on.

If you can accept wearing shoes, you can wear a mask.",63252128,Kamchatka,14
107935775,"I shouldn’t be surprised to see us all die because of American ego trips.  A mask right now is not a symbol, it is a tool of protection from a deadly germ.  Get over yourselves before we all pay the ultimate price.",87701435,Nh,15
107934422,"To paraphrase Supreme Court Justice Holmes: You have a right to free speech, but not to falsely yell ""fire"" in  crowded theater.  If a personl in the exercise of his or her individual rights chooses not to wear a mask and in the process exponentially infects others, surely such a selfish person infringes on their rights. Our politically motivated president has purposefully failed to set a proper example in this regard by also refusing to wear a mask. Hopefully our nation will be able to repair the damage wrought by this man's warped attempt to ""Make America Great Again.""",68484538,new jersey,10
107934970,"Good article. Two upgrades:
1.  You did not ask and answer the main reason for why so many  people refuse to wear masks: Trump is indeed leading - his base to the abyss and they follow his every move - he says that the virus is a hoax and doesn't wear a mask.  Trump and his  people have a very warped sense of liberty and freedom. It was never about doing whatever you want whenever you want to whoever you want to. And trump's sick mantra is, ""real men and my people don't wear masks. This is sick and was not called out in Jesse's article.  TRUMP is the reason people are not wearing masks.

2.   Here's a game: get trump to wear a mask in all public appearances and to tell the nation he was mistaken and that until further notice, everyone put on their mask.  Watch how many more people put on their masks. 
Include physical distance and hand washing, stay home. 
Then watch.",71818846,San Francisco,8
107936118,"And  put it over your nose, not resting on your upper lip. And in the grocery store, stop constantly adjusting you’re mask touching your mask on the outside of your nose and then squeezing the avocados, transferring whatever you may have directly to other people’s food. And do I really have to say this?? when you meet one of your friends, don’t pull down your mask so you can have a conversation. Thank you.",67105521,CT,19
