sn,comment,user,loc,thumbups
107936355,"I’m fortunate enough to be both an American and European citizen, and moved back to New York last summer after nearly a decade in Europe. My observation since moving back is how fragile and entitled so many Americans are. Where is the grit and resilience in the face of a challenge? I hear so much whining and self-pitying that it is, quite frankly, nauseating. These “anti-maskers” are not standing up for anything; instead I see weakness and fear.",76861384,"Brooklyn, NY",84
107936353,".......""which should be a basic element of citizenship in any democracy"". 

Is it any surprise that there seems to be a correlation between those who scorn mask wearers and wearing, and those who will tell you that the USA is not a democracy but a constitutional republic - a disingenuous and incorrect resort to mutual exclusivity to support voter suppression? 

In any event I quibble with the phrase. Wearing a mask is a sign of common decency and respect for others not related to or dependent on the system of government. It is a transcendent ethical requirement.",83529637,CT,19
107936345,"With you on wearing a mask though I disagree with you about how murky the information was early on about mask wearing.  Yes, we have more science now because we've had such a huge surge, but Chinese doctors were reporting in January that the virus was spreading by asymptomatic people & we watched while Korea shut the virus down in short order and mask wearing was part of their solution.  It was also part of china's solution in flattening the curve.  And certainly we've had the science in recent months, knowing it spreads mainly by air.  States who didn't require mask wearing simple were ignoring the science and their hospitals and public are now paying dearly for that ignorance.  

I hope we learn from this experience.",59589583,NY,12
107936310,"By definition, wearing a mask demonstrates that you care about the well-being of people other than yourself.

Now, I ask you, does the description, ""They are known most for caring deeply about people other than themselves"" spring quickly to mind when you think about Republicans?

Thus, the reluctance if not outright refusal to wear masks by people like Trump and Republicans generally is easily understood.  Wearing a mask is predicated on a quality they singularly lack:  

Caring for others.",68358603,"Wake Forest, NC",21
107936291,"In regard to Mr. Castellanos' comment that secularists suffer from the conceit of moral superiority because we wear masks to protect ourselves and our fellow citizens. Well, if the measure of morality is whether you are smart and rational enough to understand the effectiveness of mask-wearing , empathic enough to be wiling to make a rather minimal sacrifice to protect the vulnerable in our communities, and self-respecting enough to not want to submit to Gods that take the side of the virus, then yes, we are guilty of moral superiority. Truth be told, however, it is religionists like Mr. Castellanos who have beaten us to the punch by several thousand years.",66659670,"Westchester County, NY",14
107936275,"Wearing a mask is obviously a good thing, but we have to consider the possibility that in many places it won't be enough.  In Arizona, for example, nearly 1/3 of people are testing positive in some areas.  The overall viral load in the environment is so high that exposure may be difficult to avoid.

What a disaster we've created by not maintaining the initial lockdown until case numbers were low!  As many people predicted, we are finding it very difficult to reinstitute draconian shelter-in-place orders.  Perhaps nationwide orders to close bars, gyms, sports arenas, museums, indoor dining, zoos, etc. and to mandate mask use and social distancing will do it.  Of course, the only thing Trump has done nationwide so far is spread covid-19, so we can't expect any meaningful action from the feds.  Simultaneous strains on hospital systems around the country, along with the enormously increased demand for testing and PPE will certainly further exacerbate our problems. 

We are in serious trouble, and absent federal leadership, there is no apparent way out.",61655087,"Chappaqua, Ny",12
107936262,Americans have totally lost the plot. The mere existence of this article is evidence enough. Politics have become more important than self-preservation.,80228085,Toronto,27
107936249,"My question is what will we be doing in a year or two if a successful vaccine has not been developed? My guess is the virus will not magically disappear, active cases will still be present exposing the general population, which means people will still be contracting the virus with new cases showing up.

So how long will this current mask wearing exercise last? What will be the next step, shut down the economy again? Or will the masks be required at least until the fall election is over?

Is wearing a mask, social distancing, daily scare reports from the press really going to be the new normal from this point forward?",62269319,MIddle GA,1
107936196,"I wonder why some people don't wear masks. Has anyone done a correlation study with people who don't wear seat belts ? I am leaning towards the conclusion that a big, if not biggest, reason that people don't wear masks is that they don't like the government telling them what to do. Do they listen to their physicians ? Do they listen to their spouses ? I don't like being told what to do, but I do wear a mask. I take classes some times and I listen to the teachers mostly. When the health authorities say a mask helps prevent the spread of Covid19, I don't take that as their telling me what to do, but just a statement of fact. I like facts, I like truth, I dislike baloney. I like seat belts, besides keeping me nice and snug in my car especially when we used to have bench seats, I believe the statistics on their protective properties in a car crash. I like to think that I think for myself. There are some people who don't believe in evolution, they must look around them at nature and not see what I see at all. I am perplexed at some a lot of people's behavior.",33688601,7450,35
107936169,"If anyone is puzzled over the over-politicized virus in the US, look no further than the fake broadcasting entity masquerading as News. A generation spent indoctrinating  Americans open to their  agenda that the country's enemies are not other leaders in the world wishing us ill will or actively trying to influence our elections, but other Americans not in the same political party has damaged this country beyond repair. 

The only thing I can see changing this is time and changing demographics. It's that bad.",68833127,USA,31
107936167,"Why does the richest country have a shortage of masks? Seriously? Because we are entertainment junkies who only consume and not produce. America gave up its manufacturing base years ago as companies went looking for cheaper and cheaper labor. The only infrastructure our government has invested in for years has been our military. Both sides, republican and democratic parties have contributed to this. So I ask again—seriously? It’s so obvious why we’re hurting.",94819046,NE,32
107936166,"Dear God, isn't it obvious that wearing a mask is an immediately available inexpensive weapon, yes, weapon, that each and every one of us, can don no pun, as an offensive / defensive method, to unify in battle against this common enemy, in what may become the greatest danger our species has faced.

Donald J. Trump could step down from his petard, render it harmless to himself, walk among We the People, be one of us, commiserate with us, mourn with us, renounce his disastrous actions of these last four years, acknowledging an epiphany, and suddenly he would find himself surrounded by a majority of Americans ready and willing to exhalt him, and help him lead us into a renewal of the America FDR envisioned.

Okay, okay, I know, but look, why not, aren't we all entitled to prove we can be redeemed, who amongst us has not made errors, even egregious errors, and gone on to realize such, and changed, or at least sought to undo the damage.

I have to at least try to accept every one of us can do great things, all we need is some event to cause the scales to drop from our eyes; Donald J. Trump is in the wheelhouse of our United States of America, his course is strewn with obstacles which blind him, but I think I see him waking up, maybe its the polls, or perhaps empathy is coming to be within him ...

Alright, I'm done, for now ...",30706749,New York,5
107936150,"Masking mandates and requirements are all well and good.  However, without any meaningful enforcement of the rules, it s all for naught!  There is a mandatory masking here, yet stores don't enforce customers to wear them.  Many small stores, no one wears masks, including workers, and delivery personnel for major corporations like CocaCola, Pepsi, Deans, etc.  

Start enforcing and fining people and they will soon follow the rules.  It is like seatbelts in many states.  The enforcement and fining soon made it too expensive not to wear seat belts.",80457964,Pennsylvania,16
107936130,"For the idealist, the coronavirus is simply a bad spirit that must be exorcised from living tissue, not with medicine, but with unswerving faith, willpower, determination, singularity, and a total disregard to science. They will always say that God is always on their side. In a field of fallen martyrs, their voices resonate like counterpoints in Bach's oratorios.

By default, President Trump attracts the extremes, both on the right and left; he allows the rules of the jungle to predominate, which to the idealist translates into a promising new territory for their novel approaches. When confronted, especially by force, they are resigned to being the last standing. They will never wear masks.",75996055,"Pittsburgh, PA",3
107936125,"Here in the U.K., masked shop workers and grocery clerks seem more pleasant to me as I show up in my mask and gardening gloves. Weirdly, it makes them more prone to chatting, as I guess they feel safer in my presence. Let’s face it, unless you’re a member of another species, you could get sick. It’s about being a decent human being.",21930875,"London, UK",42
107936109,"Add to the reasons for the decline in the northeast that people are following directions here by staying home and have been doing so for months. In Massachusetts, you cannot go into a public building without a mask on, and people obey that directive. Going unmasked or at all to an indoor bar or restaurant? Not a chance. And where did that get us? We as a country have basically started over regarding fighting the pandemic. Once again, people in the northeast did the right thing and have to pay for the willful obstinacy and ignorance of science and common sense of people in the rest of the country.",691730,New England,32
107936089,"The ""thing"" is one can't assume that we are working towards the same goal. Funny and sad that a simple piece of fabric can be turned into a wedge and used to split the herd at time when unity is needed.  I just hope that the larger part of the herd gets out and votes, that would be a heartening indicator that people understand.",80988553,MA,16
107936088,"Accidentally causing the  death of an individual is called manslaughter. Causing the death of some 120,000 and counting,  is called mismanagement.",55769985,Geneva,33
107936073,"Mask wearing is extremely important, obviously, what is also important is the following: keeping ‘socially’ distant 6 feet from others out in public, and thoroughly washing one’s hands for at least 20 seconds upon returning home or, really, upon entering any building.",28527370,NYC,11
107936064,Masks continue to prove themselves effective in experiments at suppressing the spread of germs of all kinds including respiratory illnesses that’s why everyone wears them in an operating room.,55432937,NYC,26
107936063,"I wear a mask at work, and in public places because I have the overwhelming desire to live to see Donald Trump voted out of office.

I intend to survive to be able to do it personally.

I want to personally see the headlines on November 4, 2020 stating that he was defeated in a landslide by the majority of American voters.

Wearing a mask is a small sacrifice for those of us who have suffered under his misrule for 4 years.",8930650,Norway ME,165
107936057,"When wearing a mask in order to protect lives during a global pandemic is perceived as tribal symbolism by many and tantamount to a political statement, you know that we’re a culture in trouble. Other nations with lesser means and resources are on the mend and we’re just getting started getting sick.",66993962,NYland,34
107936055,"In my very people dense NJ city you are not allowed in a store unless a mask is worn.
Outside just about everyone is wearing a mask.
Why- because most of us are scared.  Over 12,000 people have died in our state and many of us know people who have gotten sick. And it’s not the flu.",65772692,Hoboken,33
107936045,"Why was Covid 19 politicized at all? I've resided in Thailand since before the first cases were reported. By late January Thailand and other countries were already preparing for the onslaught. In early February I entertained a guest from America in Thailand and Singapore. The government in Thailand was then already acting on evidence from China and other countries that the SARS-CoV-2 virus could spread via respiratory particles from people with none of the known symptoms of Covid 19. My American guest obtained a supply of N 95 masks while travelling in SE Asia. American health authorities still declared masks unessential.  What rapidly became clear was that the Americans, and to some extent Europeans, were making a political game out of the pandemic. While experts can not agree on the exact nature of symptoms, even today, how can the layman be expected to self diagnose and self isolate? The CDC's position 'Do not wear masks' represented flawed logic as well as flawed science, inspired by a huge dose of politics. The upshot is that America's death rate from Covid 19 stands at 400 times the rate in several SE Asian countries, including Thailand. People in Thailand continue to wear masks even as six weeks have passed with no new cases. This we do this as a courtesy to others, since speech can generate aerosols with live virus. Science is never proven, but the evidence in favor of masks is impressive.",54041650,Bangkok,23
107936029,"I am sorry it had to come to this, but I have been saying this since March.  The research was there, but I guess you needed to be a rocket scientist to get it.  I don't plan to wear a mask when I walk outside or hike, but I will go out early in the morning, not when it's crowded.  Unless you are at an outdoor close quarters party, transmission is not likely outdoors. Let's use science.  Transmission will drop in the next few weeks with the mask mandate, but we can't go back.  This is selfish for me.  I need my Air BnB rented LOL.  I don't want the economy to tank.  I also don't know if i can get the vaccines because I have SIRVA from a tetanus shot, so I may be wearing a mask forever.",68426824,USA,2
107936023,"One wears a mask not because they are comfortable, fashionable, or for political reasons, but because it's a civic duty to protect our brothers and sisters, mothers and fathers, grandparents, and most importantly to protect our health care teams, essential workers and our economy.

Almost all who do not wear masks do so out of a misbegotten sense of civil disobedience, a false sense of political messaging, and because the chief potentate refuses to wear one.

Perhaps, if Trump made available face masks that were stark white and continued up over the face conically until it formed a white point above the head, then his supporters would feel White empowered enough to wear them.

Only #45 would declare himself a wartime president, divide the country against itself, and reveal he is promoting a civil war.",41161428,Maine,50
107935988,"Let's agree that masks are effective and should be mandated. Let's agree that President Trump's reluctance to wear a mask is not helpful but we have Governors, legislatures and state health departments who can address that also. Their record has been spotty at best. This opinion piece is quite selective and laced with partisan statements and inferences. There's a lot of blame to go around. The warnings about a coming pandemic have been coming for almost a decade but actual preparations manufacture of adequate number of masks, ventilators etc were not stockpiled in adequate numbers by Bush, Obama or Trump. And don't pretend any mask covering is really just as good as an N-95 mask. Why are doctors wearing them? The reason masks are not mandated nationally or in NYS is simple: our leaders are afraid of paying a political price. Cuomo took daily victory laps on TV while the number of deaths, especially in nursing homes where he mandated they go, amounted to 25% of national deaths. We have two and a half percent of the population. Something is rotten in Denmark   err NYS. Wear masks!!!",44519404,manhattan,4
107935933,"Totally agree as do most people regarding masks. The other part of the health equation needs to be recognized. For some reason we think that it has been OK to congregate by the thousands in every city in protests. Yes it is our right. Yes the cause was very worthy. Yes a month of protests was dangerous to the health of millions of Americans. 
We can't just look the other way and justify the protests and tell each other that was different. We are either all in or we're not.",111977955,Washington DC,13
107935931,"My family is politically split down the middle - one thing we all agree on is wearing masks. As my Trump-supporting, Fox News watching sister says, ""just wear a mask, what's the big deal?""",65855058,"St. Louis, MO",13
107935916,"Only a nationwide order to wear backed by penalties when necessary will work. We are no longer dealing with rational people and when we act as if everyone is rational it is us who are irrational. During the ""Spanish flu epidemic people were still rational but not now.",68616850,Florida,16
107935908,"Speaking of masks, let's take a moment an thank a group of unsung heroes.

 The cotton masks that most of us now wear were simply not available at the start of this pandemic. In March, when it became clear that we needed millions more masks than commercial manufacturers could produce, private citizens stepped up and began making masks.  They've made millions, giving them away to friends and family,  donating them to nonprofits, and selling them locally and through online platforms like Etsy.

Commercial manufacturers are now ramping up, but it's the army of home sewers who were able to deliver these masks when we needed them.",18463741,Ohio,88
107935897,"We all knew Fauci and the Feds were lying months ago when they said masks weren't useful.  We guessed correctly that they guessed correctly that if Americans were told that masks were useful, then there would be a run on them and they wouldn't be available for the hospital workers that needed them.  

Of course, since Americans knew the Feds were lying, they all went out and bought up all the masks anyway and the hospitals quickly ran out of PPE.  If the feds had been smarter, they would have told the truth and implored Americans to allow hospitals to procure the masks.  

It doesn't matter in the end because people being people, we hoarded the masks anyway, but at least then the Fed wouldn't have to deal with the later fallout now of people not believing them. There are so many side issues that emerge when people lie.  It destroys trust and trust is so necessary for so many things.",3117356,Philadelphia,12
107935878,"I work in health care as a buyer in a coastal city. Yesterday I spoke with one of my reps over the phone who lives in the breadbasket of America. At some point I said ""we as a nation are mishandling the pandemic."" And immediately I could tell that I had upset her though she, to her credit, was cordial and nice as she always is. I mentioned that I didn't know if we were having fireworks in my city, and asked her if the virus had touched her town and whether they were having fireworks. She said that the governor and mayor of her town just instituted rules requiring people to wear masks all the time. She then said that they were having fireworks and that they would all be outside, without masks, and hugging. My jaw dropped. But what could I say? To these people, the issue of their supposed rights and freedoms TO NOT WEAR A MASK is like a religious belief. And no matter what the death toll, there is nothing that I or anyone can say to change their beliefs.",89936507,Τροίας,27
107935868,"""I don't believe that government should mandate to make sure that every person must wear a mask or otherwise face a fine or go to jail. It's wrong to deprive someone of their liberty just because they're not wearing a mask during this challenge and that's why he and I just disagree upon it."" - Greg Abbott on 12 June


“Wearing a face covering in public is proven to be one of the most effective ways we have to slow the spread of COVID-19. We have the ability to keep businesses open and move our economy forward so that Texans can continue to earn a paycheck, but it requires each of us to do our part to protect one another — and that means wearing a face covering in public spaces.” - Greg Abbott on 2 July

While it is good to recognize when you are wrong and make necessary corrections, it is equally good to acknowledge and apologize for the error as well.",73756031,"Auburn, GA",21
107935867,Kellyanne Conway states that no one is telling people to wear a face mask. Really? What alternative universe does Conway live in? Trump is not telling people to wear masks. Trump has politicized mask wearing and his minions follow.,67491320,Massachusetts,21
107935848,"I was an AFS exchange student to Japan during the summer of 1973. I remember seeing someone wearing a mask while I was there. I asked someone in my adopted family, why the person was wearing a mask. I was told it was because the person might have had a cold and he didn't want to make others sick.

 Years later I found out that in Japanese culture it is COMMON COURTESY to wear a mask when someone is sick .This is done so that the sick person doesn’t infect others. In a country like Japan where the cities are densely populated stopping disease from spreading is very important. Japanese are taught from a very young age to do things for the good of the community. In the US, individual rights are more important than those of the community and so we have some Americans unwilling to do something for the good of all; even in the time of a pandemic. 

BTW: In addition to wearing the masks for health reasons, they’ve become part of Japanese fashion. This is just one quirky and endearing cultural habits of Japan.",56505972,"South Dartmouth, MA",67
107935841,I'm a nurse in critical care.  I wear a mask for 12 hours a day when working.  Whenever I venture into a store or get take out I don a mask.  When I see individuals who do not I can't help but see childish selfishness.  People think this is about freedom.  It isn't.  It is about caring for others and if we can't do that then this is going to be a longer darker road then it already has been.,60522470,"Meriden, CT",143
107935831,"Like any public-health recommendation, some people will wear masks, and others won't. If wearing a mask becomes a requirement, some people will refuse, and you will have an escalation that does more harm than good.

What seems to escape people is that even if only 30% of the population follows the instructions, this will still help in flattening the curve.

What doesn't help, however, is saturating media bandwidth with debates about masks. I have yet to see an editorial about ICU expansion, for example. This is now the 6th or 7th editorial on masks. The two may not be mutually exclusive in real life, but they appear to be mutually exclusive in terms of media bandwidth, and that means a lot more people are going to die.",43810488,Stockholm,3
107935827,"""It's a free country, I can do what I want.""
I learned that as a child. 
 It wasn't long before my wonderful mother told me.
""You can only do what you want IF it doesn't harm other people"".
It's a free country; yet we cannot shot people.
It's a free country; yet we need a drivers license to drive and car insurance.
It's a free country; Yet we can't drink or text while driving.
It's a free country: yet many people chose to follow the 10 commandants.
It's a free country: that's why we have health checks at restaurants to keep the country healthy.  
It's not a free country.  Remember the words ""law abiding citizens"".  We have many laws which we are supposed to follow which actually allow us to be free.  
It's NOT a free country for many when people choose not to wear masks and other people sick.  
It's Not a free country when our current Health care heroes become sick caring for the sick because others think wearing masks is restrictive. 
Masks work.  Social distancing work.",65634231,ILL,34
