sn,comment,user,loc,thumbups
107937225,"Pensacola -- Everyone I saw yesterday, at the doctor's office, at the strip mall, at Kohl's, in the street was masked up. Young, old, male, female, you name it, they were being responsible, even socially distancing.

It took the governor and mayor to make this happen, but it finally did. Several days ago, mask-wearing was @ 50-50, and no social distancing.

It's business as usual pretty much down here, but I heard our quaint downtown area with its many interesting shops and themed restaurants is a ghost town. Another good thing, for now anyway. Takeout, however, is booming; long lines at all drive-thrus.

So I'm heartened, and you should be, too. When we've tried everything else, our backs to the wall, and the law insists, then even Floridians finally do the right thing.

Therefore, maybe a majority of Floridians will finally understand that Trump is a terrible man and a terrible president. I think that they will. I predict that Florida will go barely blue in November. My neighbor still flies his Confederate battle flag after all even on the Fourth of July.",69580355,From NW Florida,6
107934284,"How sad, unfortunate and selfish that a good majority of Americans care more about their own inconvenience, are defiant and believe the masks are an  infringement to their rights. This sense of arrogant denial is the reason the COVID-19 cases are rising in the U.S. and millions still don’t get it. Many chose to follow Trump’s lead in not wearing a mask and many are now paying the price whereas Trump gets tested daily and has the best medical care in the world should he become infected.",66775831,New York,5
107937997,"You're preaching to the choir. Everybody who wears a mask, even those who hate it, understands why it's important to wear a mask. The vast majority of those who refuse to wear one also understand why it's important, but their personal agenda trumps this understanding. You're addressing the wrong issue in trying to make people understand why they need to wear a mask --- we already understand.

The right issue to address is the one that keeps people from washing their hands after using the bathroom; that tells them it's okay to hock up and spit on the sidewalk, down there close to where kids are walking; that has them sit in a crowded airplane and cough for the duration of a 2,000 mile flight; that has them sneeze loudly and violently without covering their mouth or nose with a handkerchief if they even bother to carry one. There is a significant portion of our citizenry that does not have a serious concern for their social responsibility. 

This is the issue, and no amount of haranguing people to wear masks will overcome this selfishness. The answer to your question about whether some people would sneeze into their hand and not wipe it off before shaking hands with someone else is, yes, they would.",56474467,Placitas,6
107934018,"The initial lies about the masks by the CDC was more harmful than the column describes.  It's not just that people are rigidly saying that ""they changed the rules.""  As someone who wears N95 masks for certain activities, I immediately knew something was wrong with their statements.  

The idea that people we are supposed to trust, doctors, lied to us remains a problem, I think.

Heck, I'm very liberal, always wear a mask and understand that sometimes changing understanding of a new phenomenon is to be expected. Fauci is a hero along with others.t But it left a bad taste that they did this.

Had they instead just said that N-95s needed to be reserved for healthcare workers, but you should wear a bandana or cloth mask, we'd be further ahead right now.  We expect lying from Trump and McConnell.  But it's a bitter pill that those who are supposed to be protecting us, put us at risk.  We've known about masks since at least 1918.",73681419,Michigan,8
107936700,"Meanwhile, Trump plans to preside over two mass gatherings, at Mt. Rushmore and in D.C., this weekend, carelessly risking the health of others in order to satisfy his egocentric need for adulation from his base.

How many will get sick from those events, put on only to stroke Trump’s peacock ego? It’s horrifying to see how little regard Trump and his minions have for their fellow Americans.",56097836,"Midwest, U.S.A.",6
107937722,"Trump is too arrogant to wear a mask; Trump has no empathy, especially for others to consider wearing a mask; Trump isn't intelligent enough to understand this virus will not get better unless this practice is adapted by everyone, thus helping our economy. We need leadership.

People that don't believe this virus is for real haven't been affected by it personally. Perhaps they should  visit with a healthcare official that witnesses the suffering and lack of equipment everyday to understand this crisis. Or perhaps have an emergency that requires the hospital but being turned away because of this Covid crisis, having to have to call an ambulance to be considered an emergency. 

Perhaps Trump will eventually be exposed to the effects of it all through his own health, being voted out, or having someone like a loved one deal with the illness. 

They simply can't think ahead, or think they have it all figured out, ignoring the staggering number of deaths, the over capacity of hospital beds.

And here in Georgia, healthcare workers are gathering a petition and presenting it to our own governor, pleading with the order of wearing of masks and closures of social gatherings.",118007543,MetroAtlanta,4
107937746,"Read something interesting yesterday, the author compared not wearing a mask to other instances where some American people ignore other health improvement or enhancement advice by the experts.  To wit, don’t smoke cigarettes, keep your body weight down, cut back on eating bags of pork rinds, do some exercise, eat more vegetables, etc.

True I suppose, but the above, with the exception of second hand cigarette smoke, does not injure my health.  Not wearing a mask these days, is a threat to my well being, and I resent anyone who does that.  Get the picture of why there is so much hate?",71789640,Northern California,6
107938498,Rugged American Individualism trumps community well-being yet again.  Sad.,58276265,Kansas,5
107937837,"I wear a mask because I'm afraid of the people who don't. Is this the person that's going to infect me, I momentarily think whenever I see someone coming toward me who isn't wearing a mask. I usually get out of their way if I can. 

I do wonder if the non-mask wearers are all orphans, because surely if they had elderly parents or other family members they'd want to protect them. But, maybe not. Selfishness and egotism are powerful motivators.",50527257,Seattle,6
107937862,"We are at war against a remarkably weak enemy—so weak, in fact, that it cannot win without our complete help. It needs our legs for travel, our droplets for transmission. The only weapons we need to defeat it are physical distancing, mask-wearing, frequent hand washing, and crowd-avoiding. Yet in refusing to do these simple things, we persist in fighting on the side of the foe. Doesn’t that make us traitors?",78931860,"Kennesaw, GA",4
107938138,"The continuing resistance to wearing a mask is mind boggling. More and more evidence shows that, in situations—particularly indoors—where social distancing is difficult, masks help protect others if you are unknowingly infected. Wearing one in crowded public areas shows you care about others. It’s one easy step you can take. If, somehow, the accumulating evidence is wrong and masks aren’t hugely effective then, at worst, you sacrificed a tiny bit of comfort. And yet Americans are sitting on the floor of Costco, threatening frontline employees, and screaming like toddlers at the prospect of this minute discomfort. You’d think we were being asked to clamp alligators to our faces.",1114910,"Middlebury, VT",4
107938426,"When I was a teenager I would justify my questionable behavior or desire to do something risky by saying “ Well other guys are doing it”, usually referring to those who were often pushing the boundaries of safe conduct.  My parents would respond with “Would you jump off a cliff if they told you to?, pointing out that peer pressure was affecting my judgment. 
A major component of maturing into an adult is recognizing when your judgment is based on questionable reasoning. Trump and his Republican base remind me of delinquent teenagers. Peer pressure is Trump’s and the right-wing media’s go-to method of controlling their base. Forget all the noise about freedom, etc excuses, they aren’t wearing masks because Trump doesn’t and because they are afraid of being bullied by their peers.",40641811,third coast,4
107936733,"As a small business owner, still in business, in what is basically a rural community, I have been heartened by all the professional and trades people who wear masks and appalled by the number of older folks, notably white women, and teenagers of all backgrounds who stand in defiance of The Mask.  The cry of ""Don't be a sheep"" and ""I have the Right"" is infinitely ironic.  These people obviously don't understand that this country was built upon sacrifice for the greater good. All the generations before us sacrificed, some with their lives, for our nation.

 Each era presents its own challenges and its own version of sacrifice.  This pandemic is our time and opportunity to step up to the plate by doing everything we can to stop the spread.  Shame on those who blatantly put the health and lives of their loved ones, friends, family, and fellow citizens at risk for a nebulous ideology based on the slippery slope of lies.",67445520,Blue Ridge Mountains,5
107936689,If you keep a distance in the open outside and don’t caugh on anyone or even talk too much I’m pretty sure the non N95 masks meant to protect OTHER ppl are superfluous and I don’t wear one guiltlessly. That being said even in a progressive state like NJ the COVID protocols are a farce and if the governor doesnt know it hes delusional. I think it’s either ‘only a matter of time before it recurs’ or there’s something else going on because the violations are rampant. Especially in tourism.,88113865,NJ,0
107936924,"Bravo for this column. The virus should be looked on as a form of biological weapon. It aims to disable and kill Americans and destroy the economy. That qualifies as terrorism.
Wearing a mask is the best weapon we have right now to fight this massive attack. There's no ambiguity. Those who refuse to wear a mask are aiding and abetting the enemy.",41261567,Canada,7
107938203,"This isn’t just about Trump setting a bad example. Covid to Trump was bad news that diminished his political fortunes. So he denied it and failed to act. Masks are an acknowledgment of the disease which Trump must therefore reject. He turned masks into a political weapon such that support for Trump requires rejection of masks. If you wear a mask or advocate for them, you’re Trump’s enemy and the enemy of his supporters. This is deviant political behavior and the destructive result is manifest.",63098882,Nevada,6
107934297,"I'm a teenager, so many of my friends don't take this situation very seriously because they're all too ""busy"" going to the packed beaches, parks, etc. to take pictures/videos together without masks, of course for Instagram, TikTok, Snapchat, etc.  

One of my friends said in a group chat the other day, ""ugh I hate masks, they legit make me suffocate."" I swiftly replied back saying, ""you'd legit suffocate when you're diagnosed with COVID.""

He saw my message and knew he lost the argument, so I guess my job was done for now. 

But, seriously, it's simply appalling to realize that some people in my generation think that ""likes"" and ""followers"" are much more important than the health and wellbeing of the people in our communities. I'm speechless.",69127336,NJ,11
107936553,"As a hearing-impaired person who wears hearing aids and works with the public, I would love to see a transparent or partially transparent mask.  Along with all the other stresses of the pandemic, being unable to hear or understand others' speaking through masks is so unpleasant.  I can't hear you, I can't lip read, and I can't gauge context because half your face is hidden.  Face shields are transparent, but have the disadvantage of being open at the bottom.   Is it hard to design a mask with a transparent panel over the mouth?",62228680,Ohio,2
107937119,"What’s our role in this national family dynamic? How do our attitudes and language contribute to the problem? You can only change that which you have control over. What you have control over is yourself.

The left has been guilt-tripping the right pretty much all my life you’re racist, you’re sexist, you’re uncharitable, you’re war mongers, you’re deplorable. I think the two sides of the political spectrum also deal with authority and guilt differently. Maybe you could say that the left has foisted a new morality onto the nation and never given folks a chance to incorporate it. Complaints about political correctness have validity. 

For years we’ve been putting our brothers, fathers and uncles on the defensive. Now comes the mask wearing thing. Maybe many in the heartland are perceiving more guilt-tripping, and reacting according to a dynamic pattern that’s always been sustained by behavior on both sides. Incessant preaching to the choir isn’t going to help here. Which only takes me back to the savvy, compassionate public health messaging that hasn’t been happening.",46912998,"Portland, OR",3
107937905,"This virus is virulent.  It doesn't care if it's a holiday, or if you're young or old.  It only infects and possibly, kills.  

If you don't want to wear a mask, then there should be designated stores, parks, or places, that you can go that those who wear masks won't go.

Have we truly devolved to this point?  For the time being, just wear a mask and go about your life.  I'll do the same for you.",67404116,"Burbank, CA",0
107938134,"It is in fact complicated.
We simply cannot trust a single thing we are told about this entire mess.
Everyone and everything is compromised.
Messages come with agendas.
What is impossible today is mandatory tomorrow.
And on the horizon is the shot.
Will “they” make it mandatory?
Will it work?
Will it make us even sicker?
What draconian nonsense is on the way?
Should we embrace restrictions and controls that will not be lifted when the virus is under control?
This is very complicated.",69569578,Seattle,1
107936902,"Mother Nature is a strict parent.  To survive, her creatures  must adapt to the environment and predators. Humans evolved because we excelled at those skills.  Now we are going backwards by ignoring global warming and treating COVID-19 as a political football, not a predator.  Mother Nature eliminates species that are weak or ignorant.  We will drift toward that destination if we ignore threats to our lives and solutions that  prevent them.  Such threats must be solved by smart plans and, importantly, cooperation from us all.  That's what makes us human.",38918957,"Boston, MA.",6
107938659,"In the past, when I have gone into stores for essentials and I saw someone not wearing a mask, I glared.  

A woman behind me standing too close in the grocery line, mask pulled down, talking on her phone, obviously just traveled into this low incidence resort area.  I put the grocery cart between us and pushed it toward her and made her physically distance.   

Camped on stunning Grand Mesa, more crowded than I have ever experienced camping, many out of state travelers, and  no one wore masks into the little vault toilet.  

A man comes striding up to my group outside a CoVid closed visitor center to ask about fishing, no mask, no physical distancing.   Are these people completely looney?  Do they not realize there is a deadly virus?  I don't want to be exposed to their cooties. 

So, I decided to say something.   On trails where passing means too close, I stop and say ""Hey, I'm an old lady and I prefer physical distancing"" through my mask.  People  comply nicely.  However, when someone gets too close to me in an enclosed space without a mask,  l am angry at their inconsiderate, selfish actions.  

Just yesterday , I was in Murdochs reading ingredients on  bags of dog food allergic dog and a maskless young man  walked up and stood right next to me.  the store does have a sign asking people to wear masks.  I turned and said, quite angry, ""I prefer people to wear masks near me"". 

Personal freedom?  We have a right for personal freedom from their germs and stupidity.",61988981,Colorado,6
107936567,"Seriously? Five months into this pandemic and now we are finally being told that masks are a critical part of the battle against COVID? July 2 and now masks are the key, but in February and March, every pundit was on cable news e.g. Dr. Sanjay Gupta - and I am NOT singling him out - I like him very much telling us - admonishing us - NOT TO WEAR A MASK!  No, we were scolded and told that we do not have the skills to properly wear a mask and that it would do more harm than good. Our great medical minds parroted this insane logic. I screamed at the TV set in mid-March, begging these pundits to please encourage Americans to wear masks at all times in public. It would crush the spread. Being told not to wear a mask was like a supervisor on 9/11 telling you to stay at your desk in the WTC, that there was no real problem. The obvious explanation that I come up with was that there was such a ridiculous SHORTAGE of masks that the pundits and government medical experts had no choice but to tell us not to wear a mask! How could the United States be so caught off guard that they could not even have on hand millions of N95 masks that we wear routinely in medical centers every day?  How sad that all of this could have been avoided.",7820434,Connecticut,2
107936767,"""This is not complicated, folks."" Oh, but it is. Another aspect less talked about but just as important is proper fit. Masks must fit properly and be worn correctly. Masks are useless if hanging off one ear like an earring. Your mask should fit snugly and securely, covering your entire nose and mouth. Masks that are too loose Nancy Pelosi's spread viral particles when the person breathes, since they easily escape the boundaries of the cloth. If your face is small, purchase a youth or child mask for best fit. Heavy beards can interfere with proper mask seal as well. Masks are preferable to bandannas and other homemade products since they are specifically shaped to fit your face. A wire nose guard improves the seal also. Signed, a healthcare worker with a lot of mask experience.",78899448,"Anchorage, AK",1
107936844,"I think public health officials need to approach this from a different angle. We know Trump poisoned the well with his politicizing masks but there are other issues. Masks are not part of our culture. For some people it feels alien. You can’t see people’s smiles, frowns, or any facial expressions in a mask. This disturbs some people. Masks are not pleasant if they have to be worn for long periods of time. We need to approach it from a psychological standpoint. Our problem is because we have no federal leadership the public is getting no consistent message that help the reluctant public accept masks. We need a media blitz that addresses the health and psychological resistance. Americans like cool. We have to make them more cool, more a fashion statement. Shaming people isn’t working and we have to find a way to get the truth out about mask wearing. Trump and his lunatic supporters have people believing all the wrong things about masks. We’ve got to change this because we all must wear masks and it’s going to be for the foreseeable future.",82617544,NM,0
107937173,"i fully support wearing a mask at all times while in pubic, but I would like to acknowledge that service workers and other essential workers have to wear masks at all times, while the bourgeoisie only need to wear them when they go out and not while they work from home. All service workers and essential workers need hazard pay immediately.",76645735,MA,2
107938434,"Sorry Mr.Wegman, but I am morally superior to many of these ant-maskers. I don't support taking children from their parents and throwing them in cages, I don't condone officers of the law knelling on people's necks or shooting citizens in the back, I don't support unregulated corporations pouring poisons into our water and our air. And I SUPPORT wearing masks in public to protect my friends and neighbors. To argue against these protections not only makes people morally bankrupt, but basically evil.",57578161,"Ajo, AZ",3
107937111,"I have pretty much resolved myself to large numbers of folk refusing to wear masks, and I don’t give a flip about their reasons.  I shall avoid them everywhere.  I can order groceries, prescription refills, clothing and alcohol for either curbside pickup or delivery, so I stay home.  The upside of so many door knob licking mask shunners - more toilet paper for me!",79213791,Louisville,1
107937699,The article assumes that no one has had COVID 19.  I have fully recovered from the virus and cannot give the virus to anyone or get sick again.  For me the mask is simply an ornament.,109721871,"Mashpee, MA",0
107937201,"The article and comments clarify that this is a no-brainer. So let's have an honest conversation about how deplorable this nation has become. I mean seriously...what adults need to be told this? How is wearing masks not a non-issue? 

We have a very serious problem that predates and supersedes this pandemic. Daily, the lives of the majority of this nation are being put at risk by a malignly ignorant, prejudiced, bigoted, uninformed minority which relies on magical thinking, conspiracy theories, lies, bullying, threats, and bad behavior to hold the rest of us hostage. 

I'm sick and tired of this deadly dynamic. As a teacher, my life and the lives of my students are put at risk from the threat of gun violence and now from these profoundly flawed human beings who think prancing around without masks trumps saving lives. My governor just announced that schools will open without required masks, meaning every teacher and student will be put at greater risk of *dying* so that we can cater to brats.

This is NOT acceptable. None of it. It's long past time that those who cherish fact, logic, ethics, and the law were heard. Stop wasting energy, time, and lives catering to a group of people who actively wish others harm. 

Time to address the diseased mindset that's put us in such peril. It's just as deadly as any virus and there is a cure. It takes education, accountability, and ignoring those who are factually wrong. 

Let's start here: require masks and fine those who won't comply.",76657927,Cleveland,3
107937811,"Spent a few days in Wyoming where there are way more Trump 2020 banners, signs, and flags then there are masked people. I avoided interactions with the locals to the extent possible.",54971898,"Boulder, Co",2
107938674,Whoever thought we would have such a visible indicator of a  person's general level of intelligence: A person in public wearing a mask; superior level. A person in public without a mask; intelligence roughly equal to body temperature.,55432692,kansas city mo,6
107936863,"Trump is scheduled to attend the No Mask & No Social Distancing fireworks celebration this evening at Mount Rushmore. In the height of a pandemic our president continues to minimize the coronavirus and to flaunt public health precautions. Meanwhile, Americans by the thousands are sickening daily and a significant number have died.

Please; we're overthinking this. President Donald Trump is anti-science and an easy mark for conspiracy theories because, although he has a college degree, he's functionally illiterate. Plus he's too vain to wear a mask.",86075582,"Winter Springs, FL",4
107937108,People who must wear glasses and a mask at the same time experience serious “fogging” of the lenses. That’s a frequent complaint I hear. Where are the inventors who can prevent this from happening and thus encourage mask wearing?,72318600,WV,2
107938087,"Oh, Kellyanne! No one is saying the public should mask up, really? Every healthcare expert, the leaders of some states and municipalities, and leaders of other nations are no one in her book. Who is that someone who’s every utterance is covered by the media? Who is it that has a built in megaphone to speak to citizens? Who is it that has a bully pulpit? Why, could it be that we just have a bully at that pulpit and not a president or leader of any sort?",86080871,"Travelers Rest, SC",1
107938486,Wearing a mask does little to protect you from others but does  significantly help to protect others from you. Most people are not educated in that regard and it is the most selfish act not to wear a mask.,64940148,NY,4
107938563,"The only people politicizing the wearing of masks is the media.  Period.  I see 20 somethings in bars and restaurants shoulder to shoulder, not wearing masks.  I see protesters that only in the last 2 weeks wearing masks; check out the videos from the first two weeks when few had masks.  

Wearing a mask is not political, it's smart.  Not wearing one is not political, it's dumb.",58303694,Atl,2
